episodeNum,speaker,line
267,SAM:,"The area's history of sightings goes back more than two centuries. Some accounts gave it bat wings, others horns, a...a tail."
267,SAM:,"And, uh, oh yeah, a horse's head."
267,DEAN:,"Of course, the sketch looks more like a Chewbacca head."
267,BOBBY:,Sounds kind of mixed up.
267,DEAN:,"Yeah, kind of like it should be fighting a Japanese robot."
267,SAM:,"Well, mixed up or not, it sounds like it might just have a body count."
267,BOBBY:,"""Camping high season harshed by human burrito""?"
267,SAM:,"Yeah. Something hung a camper up in a tree, then ate him alive right through his sleeping bag. His wife hasn't been seen, either. Plus, there have been four other missing persons reported in the last three weeks. State troopers -- get this -- are saying it's a rogue bear."
267,DEAN:,"Yeah, of course, when was the last time you saw a bear string up its own piñata?"
267,BOBBY:,"Something's out there in the woods. Hey, we're going honest to goodness wilderness hunting. I haven't used my .30-30 in a while."
267,DEAN:,"Okay, Davey Crockett, well, safari's gonna have to wait till tomorrow and after our suit-and-tie dance. We'll make sure this is not just some backwoods crackhead who likes to roll glampers."
267,BOBBY:,What the hell's a glamper?
267,DEAN:,Sam?
267,SAM:,"High-end camper. TV, A.C., Wi-Fi. Back to nature, zero inconvenience."
267,BOBBY:,That's idiotic.
267,SAM:,Yeah. Some people just don't know how to live.
267,DEAN:,"So, Ranger Evans –"
267,RANGER:,"Oh, uh, you can call me Rick. Ranger Rick."
267,DEAN:,"Uh, you were the one who found Mitchell Rayburn, correct?"
267,SAM:,State police have it down as a bear attack.
267,DEAN:,"Apparently, some others reported seeing something a little, you know, weirder."
267,DEAN:,So you're thinking it's Mother Nature?
267,SAM:,Who's Phil?
267,SAM:,But you think maybe your assistant chief ranger might be missing?
267,DEAN:,"Oh. Excuse us. Well, you, uh... enjoy your lunch... Ranger Rick."
267,DEAN:,So?
267,BOBBY:,"Well, I took a look at the cadaver -- what's left of it. Not a happy camper. Don't have any stats on a Jersey Devil, but the bite radius on the vic's wounds -- it's too small for a Leviathan. And he's still got a ventricle and some change, so I doubt we're talking werewolf. And a wendigo don't leave no scraps."
267,DEAN:,Hmm. Lunch?
267,BOBBY:,Starving.
267,DEAN:,"Hey! Uh, Brandon. We grab a booth?"
267,BRANDON:,"Hey, uh, douchewad, a hostess will seat you. Do I look like a freaking hostess?"
267,DEAN:,Do you want to look like a hostess?
267,SAM:,"That didn't really make sense, what you... said."
267,DEAN:,What was that?
267,BOBBY:,I sure hope we don't get Brandon's section.
267,BRANDON:,Sidewinder soup and salad combo goes to Big Bird.
267,BRANDON:,TDK slammer to Ken Doll.
267,BRANDON:,And a little heart-smart for creepy uncle.
267,DEAN:,What is your problem?
267,BRANDON:,You are my problem!
267,BOBBY:,"Oh, Brandon's got his flare all up in a bunch."
267,DEAN:,"Anyway, chief ranger -- I don't think he believes in the Jersey Devil."
267,SAM:,"Oh, oh, by the way, did he seem a little, uh, stoned to you?"
267,DEAN:,Ranger Rick? Yeah. Definitely growing his own on the back 40 and smoking all the profits.
267,SAM:,He did seem to think that there was something --
267,DEAN:,"[talking with mouth full] Oh, that is good sandwich."
267,BOBBY:,What the hell did you get?
267,DEAN:,New Pepperjack Turducken Slammer -- limited time only.
267,BOBBY:,Bunch of birds shoved up inside each other. Shouldn't play God like that.
267,DEAN:,"Hey, don't look at me sideways from that -- that Chinese chicken geezer salad there, okay? This is awesome. Like the perfect storm of your top-three edible birds."
267,SAM:,"All right, anyways, um... The ranger did seem to think there was something out in Wharton Forest."
267,BOBBY:,"Well, then I'd say it's safari time."
267,MAN:,She’s big-boned!
267,BRANDON:,Look at her! You're telling me she's not fat?
267,WAITER:,Hey.
267,BRANDON:,"Up yours, Mike. Shove it right up yours!"
267,DEAN:,"Well, anyway, back to bigger and better things."
267,BOBBY:,Couple of bucks. Head-butting over turf probably. Pretty sure the other fella won.
267,SAM:,"I guess I forgot. Before you were a hunter, you were actually a...hunter."
267,BOBBY:,"Yeah, well, we shot our dinner when I was a kid."
267,DEAN:,"You used to take us hunting. Remember? Dad had a case, he'd just dump us on you. Shoot, you must have taught us most of the outdoor tracking we know."
267,BOBBY:,"Yeah, what I could get to stick. I never could get you little grubs to pull a trigger on a single deer."
267,DEAN:,"You’re talking about Bambi, man."
267,BOBBY:,"You don't shoot Bambi, jackass. You shoot Bambi's mother."
267,DEAN:,"Well, looks like we found Phil."
267,DEAN:,That's what I said.
267,SAM:,"Yeah, yeah. Solid move, Rick."
267,BOBBY:,"Ranger, I think we've got company."
267,SAM:,Ranger!
267,SAM:,Ranger Evans! Ranger!
267,BOBBY:,It's got him up in the trees. Lights off.
267,DEAN:,What?
267,SAM:,"Wait, Bobby, you think that's really a good idea?"
267,BOBBY:,"Shut up, shut off, and listen."
267,BOBBY:,Damn thing’s eating Rick.
267,DEAN:,"Man, I liked Rick."
267,DEAN:,"Wow. Nice shot, Bobby."
267,SAM:,Seriously.
267,BOBBY:,We all got our gifts.
267,DEAN:,What about the rest of Ranger Rick?
267,BOBBY:,Ranger called in his 10-20. His own will find him. We got crap to do.
267,BOBBY:,"Built like a supermodel, but the thing was strong. That's for damn sure. Carried a full-grown man up a tree in nothing flat."
267,SAM:,"But, it only took one bullet to bring it down."
267,DEAN:,"And not even a silver bullet, just a bullet-bullet."
267,BOBBY:,First one must have just stunned it.
267,DEAN:,"All right, well, let's check its hulk pants for some ID."
267,DEAN:,"Oh, that is just gonna ruin the leather."
267,BOBBY:,Are you feeling okay?
267,DEAN:,"Yeah, I feel great."
267,SAM:,"Gerald Browder, uh, lived here in town, 5'9"", brown hair and blue eyes... 235 pounds."
267,DEAN:,Whoa.
267,BOBBY:,"Well, apparently, he's lost a little pudge."
267,DEAN:,Maybe it's a-a lap-band side effect.
267,BOBBY:,What the hell? I think we better have a look under Gerald's hood.
267,BOBBY:,God! Its organs are swimming in the stuff.
267,DEAN:,You guys getting hungry? I'm hungry.
267,SAM:,What's that?
267,BOBBY:,"His stomach. For a guy on a diet, Gerry here packed it in pretty good."
267,SAM:,That's human right there.
267,BOBBY:,That's fresh Rick. Let's see. Plus... a pine cone? Pack of gum in the wrapper.
267,SAM:,That's -- that's older. Maybe like a -- maybe Ranger Phil or the camper.
267,BOBBY:,What's that?
267,SAM:,"Looks like a -- yeah, that's a -- that's a cat's head."
267,BOBBY:,"A glamper or two is one thing, but you got to be damn hungry to eat a cat's head."
267,SAM:,Mm-hmm.
267,BOBBY:,"Well, lookit here. I'm no Dr. Oz, but..."
267,BOBBY:,I think that's his adrenal glands.
267,SAM:,Okay. And?
267,BOBBY:,Meant to be the size of hotel bar soap... and bright orange.
267,SAM:,"Ooh! All right, that might help explain the strength. Um, but whatever this thing is, it's not the Jersey Devil, but it sure as hell ain't Gerald Browder anymore."
267,DEAN:,"Okay, guys, seriously. It's time for dinner?"
267,SAM:,"Gerald Browder, 35, self-employed. Air-conditioning repairman."
267,SAM:,Missing person number three. Disappeared eight days ago.
267,BOBBY:,"Well, that explains all the people who got eaten in the last eight days."
267,SAM:,"Yeah. Question is, what happened to him?"
267,SAM:,"Dean. Uh, so, what do you think?"
267,DEAN:,[talking with his mouth full] I'm not that worried about it.
267,BOBBY:,Excuse me?
267,DEAN:,"That's funny, right? I could give two shakes of a rat's ass. Is that right? Do rats shake their ass, or is it something else? Eh."
267,SAM:,Give me that.
267,DEAN:,"Whoa, whoa! Why?!"
267,BOBBY:,"There's some funky chicken in the TDK Slammer, ain't there?"
267,SAM:,Yeah.
267,DEAN:,This is stupid. My sandwich didn't do anything. I don't know what you think you're gonna find.
267,BOBBY:,"There's something wrong with you, Dean."
267,DEAN:,Are you kidding? I'm fine! I -- I actually feel great. The best I've felt in a couple months. Cas? Black goo? I don't even care anymore. And you know what's even better? I don't care that I don't care. I just want my damn slammer back.
267,SAM:,"Dude, you are completely stoned, just like Ranger Rick was."
267,BOBBY:,Just like the dinner rush back at Biggerson's. And everybody's loving the Turducken.
267,DEAN:,I think you pissed off my sandwich.
267,DEAN:,That -- that's in me?
267,SAM:,O-only half of it.
267,BOBBY:,Does that snot look familiar?
267,SAM:,"Okay, so whatever turned Gerry Browder into a pumpkin head... and is currently turning Dean into an idiot --"
267,DEAN:,I'm right here. Right here.
267,BOBBY:,Is in the Turducken Slammer at Biggerson's.
267,SAM:,Yeah.
267,BOBBY:,It's in the meat.
267,DEAN:,"If I wasn't so chilled out right now, I would puke."
267,SAM:,How's he doing?
267,BOBBY:,He's sleeping it off. Tryptophan coma.
267,SAM:,"So, you think he's okay?"
267,BOBBY:,"Yeah, he's all right."
267,SAM:,Good. So you don't worry about him?
267,BOBBY:,What do you mean? Before the Turducken?
267,SAM:,"Yeah. Yeah, I kind of mean more like, uh... more like ever since my head broke... and we lost Cas. I mean, you ever feel like he's -- he's going through the same motions but he's not the same Dean, you know?"
267,BOBBY:,How could he be?
267,SAM:,"Right, yeah, but what if --"
267,BOBBY:,"What if what, Sam? You know, you worry about him. All he does is worry about you. Who's left to live their own life here? The two of you --  aren't you full up just playing Snuffleupagus with the Devil all the live long?"
267,SAM:,"I don't know, Bobby. Seeing Lucifer's fine with me."
267,BOBBY:,Come again?
267,SAM:,"Look, I'm not saying it's fun. I mean, to be honest with you, I-I kind of see it as the best-case scenario. I mean..."
267,SAM:,"...at least all my crazy's under one umbrella, you know? I kind of know what I'm dealing with. A lot of people got it worse."
267,BOBBY:,You always were one deep little son of a bitch.
267,SAM:,"Wait, wait, wait. Here we go."
267,BOBBY:,"Well, I guess we follow him."
267,SAM:,"That's weird, right? I mean, national franchise like Biggerson's getting meat from a place that looks like it wholesales Hong Kong knockoffs."
267,DEAN:,Okay. Yeah. It's a little weird.
267,SAM:,"All right, well, I guess we wait till they close up shop, go take a look around?"
267,BOBBY:,Hang on.
267,SAM:,No.
267,SAM:,Edgar.
267,DEAN:,Leviathans.
267,DEAN:,Son of a bitch.
267,BOBBY:,What the hell is going on?
267,EDGAR:,"Put him with the others, if you don't mind."
267,EDGAR:,I'm back because of the experiment. What's happening? You said you were refining the formula.
267,EDGAR:,But it didn't solve our little issue with adverse reactions.
267,EDGAR:,Burn them.
267,EDGAR:,Dick is coming.
267,BOBBY:,How's your head?
267,DEAN:,"Well, I think the slammer's pretty much wore off. In between that and the 20 cups of coffee, I'm nicely tense and alarmed."
267,BOBBY:,I wasn't talking about that.
267,DEAN:,"Oh, Bobby, don't -- don't go all Sigmund Freud on me right now, okay? I just got drugged by a sandwich."
267,BOBBY:,I want to talk about your new party line.
267,DEAN:,Party? What are you talking about? I don't even vote.
267,BOBBY:,"""The world's a suicide case. We save it, it just steals more pills""?"
267,DEAN:,"Bobby, I'm here, okay? I'm on the case. What's the problem?"
267,BOBBY:,"I've seen a lot of hunters live and die. You're starting to talk like one of the dead ones, Dean."
267,DEAN:,"No, I'm talking the way a person talks when they've had it, when they can't figure out why they used to think all this mattered."
267,BOBBY:,"Oh, you poor, sorry... You're not a person."
267,DEAN:,Thanks.
267,BOBBY:,"Come on, now. You tried to hang it up and be a person with Lisa and Ben. And now here you are with a mean old coot and a van full of guns. That ain't person behavior, son. You're a hunter, meaning you're whatever the job you're doing today. Now, you get a case of the Anne Sextons, something's gonna come up behind you and rip your fool head off. Now, you find your reasons to get back in the game. I don't care if it's love or spite or a ten-dollar bet. I've been to enough funerals. I mean it. You die before me, and I'll kill you."
267,DEAN:,"We need to scrape some money together, get you a condo or something."
267,SAM:,Hey. Something's up.
267,BOBBY:,"Well, I'll be a squirrel in a skirt. It's Dick frigging Roman."
267,DEAN:,What? Who the hell is Dick frigging Roman?
267,REPORTER:,"Billionaire Dick Roman, seen here at a recent press conference, has been on the corporate-takeover warpath in the last several months and shows no signs of relenting."
267,REPORTER:,"Whether at the helm of his America's cup-winning yacht or one of his Fortune 500 companies, Roman has never shied away from the spotlight. Roman's record-breaking series of motivational seminars, ""When in Rome,"" have outsold every other money-making program on the market. A vocal member of the NRA and a steadfast supporter of the second amendment, Roman has started attracting some conservative political attention, as well."
267,DEAN:,Holy crap. What the hell is that?
267,SAM:,"That's one of the top 50 most powerful men in America, Dean."
267,DEAN:,Says here top 35 as of last month. Now it's all making sense.  Remember when Crowley kept going on about hating Dick? I thought he was just being general. Pfft!
267,BOBBY:,"Well, if the Leviathan got to him, then that means they're playing on a much bigger board than we were thinking."
267,SAM:,"So what, then? I mean, we can't exactly outgun them."
267,BOBBY:,"No, but we got the drop on them. Means we got a chance to figure out what these guys are really doing here."
267,DEAN:,Whoa. Where'd you get that mother?
267,BOBBY:,It's on loan from Frank's big brother collection. It'll pick up vocal vibrations from window glass at half a mile. It's time to find out what these ugly bastards are up to.
267,WOMAN:,And I'll reschedule with the Senator for lunch Tuesday. You can deal with the archdiocese in the afternoon.
267,DEAN:,They got him.
267,SAM:,"Dean, there are at least four Leviathans out there. We don't even know how to kill one."
267,DEAN:,"Well, it'll be quite a shock when we walk in through the front door, won't it?"
267,WOMAN:,"We'll have the jet on standby at O'Hare. Thursday morning, you close on the land acquisition in Gleason."
267,WOMAN:,And this came this afternoon.
267,WOMAN:,Sotheby's.
267,SUSAN:,Hmm?
267,BOBBY:,So you got Dick Roman.
267,BOBBY:,"Oh, you're hurting my feelings."
267,BOBBY:,What do you got there?
267,BOBBY:,I'd appreciate one right about now.
267,BOBBY:,"Oh, let's just cut to the chase. I clearly ain't worth the extra time I'm getting here."
267,BOBBY:,"Nah, they're too smart. They know they don't have the numbers. It'd be suicide. I've run my race. Could die worse."
267,BOBBY:,"Okay, sons of bitches. See what you're up to now. You're coming with me."
267,DEAN:,Go! Go!
267,SAM:,"Damn it, where's Bobby?"
267,SAM:,Bobby! Come on! Come on! Come on!
267,BOBBY:,Go! Go!
267,DEAN:,Son of a bitch! I'm glad you got in. He almost took your freaking head off.
267,SAM:,"Hey, Bobby, your hat."
267,SAM:,"Bobby? Oh, God. Bobby? Bobby?"
267,DEAN:,Bobby?!
268,SAM:,"Bobby? Bobby? Hey, hey, hey, hey. Hold on."
268,DEAN:,"Sam, is he dead?"
268,SAM:,I’m checking.
268,DEAN:,Is he dead?!
268,SAM:,"Just drive, Dean! Bobby!"
268,DEAN:,"You gotta talk to me, Sam!"
268,SAM:,"All right, he’s breathing. There’s a pulse."
268,DEAN:,Keep him upright. Stop the bleeding.
268,SAM:,"I’m not an idiot, Dean! I know first aid for a friggin’ bullet to the head!"
268,SAM:,Hold on. Hold on.
268,DEAN:,"All right, Bobby, hang in there."
268,SAM:,Bobby! Just hold on!
268,DEAN:,"Well, I guess we found Phil."
268,BOBBY:,Wait a minute. Something’s not right here.
268,DEAN:,"Yeah, no kidding, Bobby. There’s a corpse in a tree."
268,BOBBY:,Something bad’s about to happen.
268,DEAN:,"Yeah, well danger’s kinda on the W2 – that’s why we got the guns."
268,BOBBY:,Or something bad’s happened already.
268,BOBBY:,Balls.
268,SAM:,Y-you want to tell us what’s going on?
268,DEAN:,"Yeah, what’s going on with your head?"
268,BOBBY:,I got shot in it!
268,DEAN:,You what?
268,SAM:,"Bobby, we’ve been with you all day."
268,DEAN:,"Yeah, I think we would have noticed if you took a bullet."
268,BOBBY:,"I didn’t take one here. I-I took one out there, i-i-in the real world."
268,DEAN:,You lost us.
268,SAM:,"Look, Bobby, you – you want to sit down, seriously?"
268,BOBBY:,"No, there’s something I gotta tell you. I-I... Dammit, I can’t get at it."
268,SAM:,"Well, it – it’s okay, take your time. We’re – we’re right here."
268,BOBBY:,I didn’t have time before to tell you what...
268,BOBBY:,...they’re cookin’ up. You need to know.
268,KAREN:,Well...
268,KAREN:,"... you just gonna stand there or hand it over, Bobby?"
268,BOBBY:,What the hell? Karen?
268,KAREN:,You were expecting Farrah Fawcett?
268,BOBBY:,No. She always calls first. [pause] That’s what I said the first time this happened.
268,KAREN:,What are you talking about? Gimme!
268,BOBBY:,Oh.
268,BOBBY:,This  – this is just like it was. You’re beautiful.
268,KAREN:,Quit sweet-talkin’ and come here.
268,KAREN:,I feel like we haven’t talked in ages.
268,BOBBY:,I know just how you feel.
268,KAREN:,"Listen, I have something I want to say to you. No excuses this time, okay? Just sit, Bobby."
268,BOBBY:,I know what night this is. I remember this.
268,KAREN:,I’ve thought about this a lot. I really...
268,KAREN:,Don’t make fun of me.
268,BOBBY:,I wouldn’t. But right now I gotta...
268,BOBBY:,I don’t remember a storm coming in the night this happened.
268,BOBBY:,Mother Mary. I’ve got a messed-up fruitcake.
268,KAREN:,"What, Bobby?"
268,BOBBY:,"Nuthin’. I gotta go. I’m sorry, darling."
268,KAREN:,"Bobby, wait! Don’t go."
268,RUFUS:,"Number-one trick, is act like you know what you’re doing, Bobby."
268,BOBBY:,Rufus?
268,RUFUS:,"What, I can’t give you advice now? All of a sudden you know everything? You know, I can always go wait in the car."
268,BOBBY:,"No, wait. I – I need your help. Bad."
268,RUFUS:,"Yeah, damn straight you do."
268,BOBBY:,"No, listen to me, Rufus. I’m gonna die!"
268,RUFUS:,"Oh, now that’s a realistic view of the mortality rate on a ghost hunt."
268,RUFUS:,"Whoa, whoa, Nellie, red line. All right, baby boy, here we go."
268,BOBBY:,"No, Rufus!"
268,RUFUS:,"Are you coming, Bobby? I mean, we’re not getting any younger here!"
268,BOBBY:,Coming.
268,MAN:,"Hello, Mr. Singer."
268,MAN:,Your time’s up.
268,BOBBY:,"So you’re my reaper, huh? You know, I’ve heard of you guy grabbing reapees in broad daylight and in their sleep, but I never heard of a reaper showing up inside a guy’s custard."
268,REAPER:,"You’re in a coma, genius. This is what happens. I climb in your “custard” and fish you out."
268,REAPER:,"Oh, you think you can lose me."
268,BOBBY:,Gonna try.
268,REAPER:,"I’ve got places to be, Singer, don’t waste my time."
268,BOBBY:,Might as well – while I got it.
268,REAPER:,You’re prolonging the inevitable.
268,REAPER:,I can find you anywhere! Even in this gin-soaked rat maze.
268,SAM:,"I'm just saying – look, you can't really compare."
268,DEAN:,I don’t even know you right now. There's not even a contest.
268,SAM:,It depends on the criteria.
268,DEAN:,"Survival is the only criteria, all right?"
268,DEAN:,"And when the crap hits the fan, it's not about who has skill. It's about who's the bigger badass. Bobby, will you please tell Sam that Chuck Norris could kick Jet Li's ass?"
268,DEAN:,You grab me a beer while you're in there?
268,WOMAN:,Bobby?
268,WOMAN:,"Bobby Singer, you had better be washed up when you come down."
268,RUFUS:,"Bobby, heads-up! Whew! Poor thing. Gets left at the altar, kills herself, and then gets buried in the crypt. Now she's going after men who break their girls' hearts. Poignant, am I wrong?"
268,RUFUS:,"Why you out of breath? Did you go for a jog up there, man?"
268,BOBBY:,"I need your help, Rufus."
268,RUFUS:,"Yeah, clearly."
268,BOBBY:,"No, listen to me."
268,RUFUS:,"I want you to grab a torch, man. As soon as I open up her coffin, showtime's coming pretty quick."
268,BOBBY:,"No. Will you listen to me, you son of a bitch? There's a damn reaper coming for me."
268,RUFUS:,"There's a damn reaper coming for all of us, Bobby."
268,RUFUS:,"All right, let's put this damn ghost to bed. I got plans for Purim."
268,DOCTOR:,Page the neurosurgeon on call. Tell OR to put electives on hold.
268,DOCTOR:,Move trauma 2 to bed 7 as soon as it's clean.
268,NURSE:,"Gunshot wound to the right frontal area, no exit wound found. Breathing spontaneously. Respiratory rate 18 and shallow. RST at 120. BP 90 over 60. GCS 5."
268,DOCTOR:,Push 80 grams of Mannitol over 30. Prep for intubation.
268,NURSE:,Air entry clear to bases.
268,DOCTOR:,Let's get a central line in here now.
268,SAM:,What's happening? Please just tell us –
268,DOCTOR:,Get them out of here.
268,NURSE:,Sorry. You need to stay out of their way.
268,DEAN:,That's our uncle.
268,NURSE:,You got to stay back.
268,SAM:,What are they doing?
268,NURSE:,We need to get him stable.
268,DEAN:,"Okay, when are you gonna take the bullet out?"
268,NURSE:,"If we can get the swelling down, if it's in a place we can get to, if –"
268,SAM:,If he even lives that long.
268,BOBBY:,Forget it. I got to keep moving.
268,GHOST:,Heartbreaker.
268,DOCTOR:,Push 30 more of Mannitol over 10. CBC and 'lytes. Bolus him with 500 saline.
268,NURSE:,The vitals were stable two minutes ago.
268,DOCTOR:,"Well, he's crashing now."
268,RUFUS:,Bobby... Come on. You okay? Say something.
268,BOBBY:,Look out!
268,NURSE:,Blood pressure 130 over 90.
268,BOBBY:,"Okay, Rufus, I need you – Oh, balls. This would be the one job you damn near got yourself killed on. Well, you're gonna be useful, even if I have to carry you."
268,DOCTOR:,"He's, uh, stable for the moment. Just have to see."
268,BOBBY:,Rufus...
268,BOBBY:,Where the hell did you go?
268,BOBBY:,"Yeah, you! You, kid! Hey, what are you making like a white rabbit all over the place for, you grubby little – enough with the jump scares, kid. Who are you running from?"
268,BOBBY:,Wait a minute. I know you.
268,RUFUS:,Did you think I was dead?
268,RUFUS:,"Call me, all right?"
268,RUFUS:,"Don't sit Shiva for me yet, Bobby."
268,BOBBY:,"Listen – after Bridezilla took you out, do you remember what you told me about your near-death experience?"
268,RUFUS:,"I haven't told you nuthin’ yet. But now that you mention it, pretty sure I almost crossed over."
268,BOBBY:,And what did you see?
268,RUFUS:,"What did I see? What are you so riled up about, paco? All right, all right. I saw a hallway, uh, plaid carpet, uh, the apartment building from when I was a kid."
268,BOBBY:,And?
268,RUFUS:,"And I wanted out. I'm not dying on no damn plaid carpet. No, thank you."
268,BOBBY:,"So, what did you do?"
268,RUFUS:,"Well, obviously, Bobby, not being stupid, I started looking for the damn exit door. Y-you know, I swear that's what they mean about your life flashing before your eyes, 'cause every time I opened the door, there was another chapter inside – the good, the bad, the bloody."
268,BOBBY:,"So, how did you get out?"
268,RUFUS:,"Found the right door, obviously."
268,BOBBY:,"Well, how did you find it?"
268,RUFUS:,"Oh, simple – I went deep."
268,BOBBY:,Deep. Like old?
268,RUFUS:,"No, deep like... Crap you do not want to think about, so you bury it, you shove other crap over it, and you don't go there, ever."
268,BOBBY:,"So, you're telling me that the way out was through your worst memory?"
268,RUFUS:,"It's an important door, Bobby."
268,BOBBY:,"Okay, this is good."
268,RUFUS:,"What the hell are you going on about, anyway?"
268,BOBBY:,"This. I got to find the right door to get this to Sam and Dean. I'm in a coma, Rufus, right now."
268,RUFUS:,[laughs] Get out.
268,BOBBY:,"I got shot in the dunce cap, Rufus. I'm – I'm dying."
268,RUFUS:,You sure?
268,BOBBY:,Unfortunately.
268,RUFUS:,"I'll be a prima ballerina. Wait, wait, Bobby. Are you trying to tell me I'm just one of your better memories?"
268,BOBBY:,Would I make this up?
268,BOBBY:,Okay. I got to go.
268,RUFUS:,What?
268,BOBBY:,"You're coming with me, Rufus."
268,RUFUS:,What?
268,BOBBY:,I need my partner on this. Please.
268,RUFUS:,"Aim for your worst memory. Think. Focus. You got it? The worst, okay?"
268,BOBBY:,I got a metric ton of worst.
268,RUFUS:,"Just take a shot. By the way, killer bride – how come she call you a heartbreaker, anyway? I mean, you a family man if I ever saw one."
268,BOBBY:,Thanks for narrowing things down.
268,KAREN:,"I can't believe you. I hate you. Everything's a lie. Our whole life, our vows... everything. You knew I wanted kids. Why didn't you just sit me down and say... I don't understand. You're a good man. You'd be a good dad. What does that even mean, you break everything you touch?! What kind of excuse is that?!"
268,KAREN:,Aah!
268,KAREN:,"Just stay away from me! You broke my heart, Bobby! You happy? Just go away!"
268,BOBBY:,Just so you know... I'm sorry. I never stopped being sorry.
268,RUFUS:,"Bobby, I thought you'd want a gang of rugrats."
268,RUFUS:,"So, how long after this..."
268,BOBBY:,"...did she get possessed? Three days. Biggest regret of my life, this fight. You'd think it was when I had to stab her to death, but... no. All through that... I was thinking we never got to get past this. If I'd have known, I'd have said anything she wanted to hear."
268,RUFUS:,Bobby? Hey. Try the door. Now.
268,BOBBY:,"Thanks, Rufus."
268,BOBBY:,Balls.
268,RUFUS:,What year is this? '89-ish?
268,BOBBY:,What's it matter? I'm still stuck in eternal friggin' sunshine.
